{
  "schema_version": "1.0.0",
  "container_design_id": "wood_handheld_compact_ceramic_mug_v1",
  "display_name": "Compact off-white ceramic mug for the Wood Handheld preset",
  "design": {
    "class": "compact handled cafe mug",
    "material": "matte off-white glazed ceramic",
    "geometry": "short compact cylindrical body with a gently rounded lower wall, thin readable rim and one complete small loop handle that follows the held reference orientation",
    "components": [
      "thin circular ceramic rim",
      "short compact cylindrical body",
      "gently rounded lower wall",
      "one complete small loop handle",
      "plain unbranded exterior"
    ],
    "height_to_width_ratio": [
      0.72,
      0.92
    ]
  },
  "allowed_transfer": [
    "compact off-white ceramic mug proportions",
    "thin rim and gently rounded lower wall",
    "one small loop handle in the natural hand-held orientation",
    "plain unbranded exterior"
  ],
  "forbidden_transfer": [
    "reference latte art, crema pattern, bubbles, recipe or topping",
    "reference text, logo, watermark or decorative mark",
    "reference hand identity, nail color or skin texture",
    "reference scene coordinates, table pixels or environmental reflection"
  ],
  "compatibility": {
    "beverage_temperatures": [
      "hot",
      "cold",
      "ambient"
    ],
    "supports_toppings": true,
    "supports_straw": false,
    "brand_surface": "plain exterior only"
  }
}
